{
  "version": "research-real-v3",
  "status": "curated-real-source-facts",
  "annotationPolicy": "New fact-level corpus with source facts separated from task wording. V3 holdout is frozen before capability tuning.",
  "splitPolicy": {
    "development": "12 new cases for architecture development.",
    "holdout": "4 new cases frozen for one-shot generalization evaluation.",
    "holdoutInfluencedTuning": false
  },
  "cases": [
    {
      "caseId": "v3-transformer-xl",
      "split": "development",
      "title": "Transformer-XL: Attentive Language Models Beyond a Fixed-Length Context",
      "category": "architecture",
      "source": {
        "arxivId": "1901.02860",
        "arxivVersion": "v1",
        "absUrl": "https://arxiv.org/abs/1901.02860v1",
        "pdfUrl": "https://arxiv.org/pdf/1901.02860v1",
        "paperRevisionDate": "2019-01-08",
        "repositoryUrl": null,
        "repositoryCommitSha": null,
        "repositoryCommitDate": null,
        "paperSha256": null,
        "paperSha256Status": "PENDING_ACQUISITION",
        "artifactPolicy": "cache_only_no_redistribution",
        "temporalAlignment": "UNKNOWN"
      },
      "facts": [
        {
          "predicate": "architecture.recurrence",
          "value": "segment-level recurrence",
          "sourceClass": "PAPER",
          "locator": "paper evidence"
        }
      ],
      "tasks": [
        {
          "taskId": "v3-transformer-xl-task",
          "query": "How does the model carry information beyond a fixed context?",
          "predicate": "architecture.recurrence",
          "expectedStatus": "SUPPORTED",
          "expectedAnswer": {
            "architecture.recurrence": "segment-level recurrence"
          },
          "expectedSourceClass": [
            "paper"
          ],
          "expectedLocator": "paper evidence",
          "annotationRationale": "Independently curated bounded fact for V3 query-independent evaluation."
        }
      ]
    },
    {
      "caseId": "v3-electra",
      "split": "development",
      "title": "ELECTRA: Pre-training Text Encoders as Discriminators Rather Than Generators",
      "category": "training",
      "source": {
        "arxivId": "2003.10555",
        "arxivVersion": "v1",
        "absUrl": "https://arxiv.org/abs/2003.10555v1",
        "pdfUrl": "https://arxiv.org/pdf/2003.10555v1",
        "paperRevisionDate": "2020-03-18",
        "repositoryUrl": null,
        "repositoryCommitSha": null,
        "repositoryCommitDate": null,
        "paperSha256": null,
        "paperSha256Status": "PENDING_ACQUISITION",
        "artifactPolicy": "cache_only_no_redistribution",
        "temporalAlignment": "UNKNOWN"
      },
      "facts": [
        {
          "predicate": "training.objective",
          "value": "replaced token detection",
          "sourceClass": "PAPER",
          "locator": "paper evidence"
        }
      ],
      "tasks": [
        {
          "taskId": "v3-electra-task",
          "query": "What pretraining signal trains the encoder as a discriminator?",
          "predicate": "training.objective",
          "expectedStatus": "SUPPORTED",
          "expectedAnswer": {
            "training.objective": "replaced token detection"
          },
          "expectedSourceClass": [
            "paper"
          ],
          "expectedLocator": "paper evidence",
          "annotationRationale": "Independently curated bounded fact for V3 query-independent evaluation."
        }
      ]
    },
    {
      "caseId": "v3-linformer",
      "split": "development",
      "title": "Linformer: Self-Attention with Linear Complexity",
      "category": "architecture",
      "source": {
        "arxivId": "2006.04768",
        "arxivVersion": "v1",
        "absUrl": "https://arxiv.org/abs/2006.04768v1",
        "pdfUrl": "https://arxiv.org/pdf/2006.04768v1",
        "paperRevisionDate": "2020-06-08",
        "repositoryUrl": null,
        "repositoryCommitSha": null,
        "repositoryCommitDate": null,
        "paperSha256": null,
        "paperSha256Status": "PENDING_ACQUISITION",
        "artifactPolicy": "cache_only_no_redistribution",
        "temporalAlignment": "UNKNOWN"
      },
      "facts": [
        {
          "predicate": "architecture.attention",
          "value": "linear attention",
          "sourceClass": "PAPER",
          "locator": "paper evidence"
        }
      ],
      "tasks": [
        {
          "taskId": "v3-linformer-task",
          "query": "What attention formulation reduces the self-attention complexity?",
          "predicate": "architecture.attention",
          "expectedStatus": "SUPPORTED",
          "expectedAnswer": {
            "architecture.attention": "linear attention"
          },
          "expectedSourceClass": [
            "paper"
          ],
          "expectedLocator": "paper evidence",
          "annotationRationale": "Independently curated bounded fact for V3 query-independent evaluation."
        }
      ]
    },
    {
      "caseId": "v3-swin",
      "split": "development",
      "title": "Swin Transformer: Hierarchical Vision Transformer using Shifted Windows",
      "category": "architecture",
      "source": {
        "arxivId": "2103.14030",
        "arxivVersion": "v1",
        "absUrl": "https://arxiv.org/abs/2103.14030v1",
        "pdfUrl": "https://arxiv.org/pdf/2103.14030v1",
        "paperRevisionDate": "2021-03-25",
        "repositoryUrl": null,
        "repositoryCommitSha": null,
        "repositoryCommitDate": null,
        "paperSha256": null,
        "paperSha256Status": "PENDING_ACQUISITION",
        "artifactPolicy": "cache_only_no_redistribution",
        "temporalAlignment": "UNKNOWN"
      },
      "facts": [
        {
          "predicate": "architecture.attention",
          "value": "shifted-window attention",
          "sourceClass": "PAPER",
          "locator": "paper evidence"
        }
      ],
      "tasks": [
        {
          "taskId": "v3-swin-task",
          "query": "Which windowing mechanism structures the attention layers?",
          "predicate": "architecture.attention",
          "expectedStatus": "SUPPORTED",
          "expectedAnswer": {
            "architecture.attention": "shifted-window attention"
          },
          "expectedSourceClass": [
            "paper"
          ],
          "expectedLocator": "paper evidence",
          "annotationRationale": "Independently curated bounded fact for V3 query-independent evaluation."
        }
      ]
    },
    {
      "caseId": "v3-vit",
      "split": "development",
      "title": "An Image is Worth 16x16 Words: Transformers for Image Recognition at Scale",
      "category": "architecture",
      "source": {
        "arxivId": "2010.11929",
        "arxivVersion": "v1",
        "absUrl": "https://arxiv.org/abs/2010.11929v1",
        "pdfUrl": "https://arxiv.org/pdf/2010.11929v1",
        "paperRevisionDate": "2020-10-22",
        "repositoryUrl": null,
        "repositoryCommitSha": null,
        "repositoryCommitDate": null,
        "paperSha256": null,
        "paperSha256Status": "PENDING_ACQUISITION",
        "artifactPolicy": "cache_only_no_redistribution",
        "temporalAlignment": "UNKNOWN"
      },
      "facts": [
        {
          "predicate": "architecture.formulation",
          "value": "image patches",
          "sourceClass": "PAPER",
          "locator": "paper evidence"
        }
      ],
      "tasks": [
        {
          "taskId": "v3-vit-task",
          "query": "How are images represented before entering the Transformer?",
          "predicate": "architecture.formulation",
          "expectedStatus": "SUPPORTED",
          "expectedAnswer": {
            "architecture.formulation": "image patches"
          },
          "expectedSourceClass": [
            "paper"
          ],
          "expectedLocator": "paper evidence",
          "annotationRationale": "Independently curated bounded fact for V3 query-independent evaluation."
        }
      ]
    },
    {
      "caseId": "v3-mae",
      "split": "development",
      "title": "Masked Autoencoders Are Scalable Vision Learners",
      "category": "training",
      "source": {
        "arxivId": "2111.06377",
        "arxivVersion": "v1",
        "absUrl": "https://arxiv.org/abs/2111.06377v1",
        "pdfUrl": "https://arxiv.org/pdf/2111.06377v1",
        "paperRevisionDate": "2021-11-11",
        "repositoryUrl": null,
        "repositoryCommitSha": null,
        "repositoryCommitDate": null,
        "paperSha256": null,
        "paperSha256Status": "PENDING_ACQUISITION",
        "artifactPolicy": "cache_only_no_redistribution",
        "temporalAlignment": "UNKNOWN"
      },
      "facts": [
        {
          "predicate": "training.objective",
          "value": "masked reconstruction",
          "sourceClass": "PAPER",
          "locator": "paper evidence"
        }
      ],
      "tasks": [
        {
          "taskId": "v3-mae-task",
          "query": "What reconstruction task is used for visual pretraining?",
          "predicate": "training.objective",
          "expectedStatus": "SUPPORTED",
          "expectedAnswer": {
            "training.objective": "masked reconstruction"
          },
          "expectedSourceClass": [
            "paper"
          ],
          "expectedLocator": "paper evidence",
          "annotationRationale": "Independently curated bounded fact for V3 query-independent evaluation."
        }
      ]
    },
    {
      "caseId": "v3-opt",
      "split": "development",
      "title": "OPT: Open Pre-trained Transformer Language Models",
      "category": "model",
      "source": {
        "arxivId": "2205.01068",
        "arxivVersion": "v1",
        "absUrl": "https://arxiv.org/abs/2205.01068v1",
        "pdfUrl": "https://arxiv.org/pdf/2205.01068v1",
        "paperRevisionDate": "2022-05-03",
        "repositoryUrl": null,
        "repositoryCommitSha": null,
        "repositoryCommitDate": null,